imsi,subscriber_id,plan_type,device_model,device_capability,subscriber_segment,lifetime_value,avg_monthly_usage_gb,activation_date,churn_risk_score,subscriber_behavior_profile
310260000000194,SUB-00000194,Essentials,Pixel 8,LTE Cat 4,Value,8273.777417456946,86.3387348854885,2026-02-09 16:03:01.328249,0.12462623723072878,"Pixel 8 user in Value segment, Essentials plan with low retention risk, 86.3GB monthly data"
310260000000195,SUB-00000195,Magenta Max,iPhone 14,LTE Advanced,MVNO,12086.050342405862,101.82096020642007,2026-01-25 16:03:01.328249,0.2946525981698367,"MVNO tier customer with iPhone 14, Magenta Max subscription, balanced usage pattern, averaging 101.8GB per month"
310260000000196,SUB-00000196,Business Unlimited,Galaxy S23,5G Sub-6,Standard,1590.6848335065567,118.65430956611807,2026-01-10 16:03:01.328249,0.6153676475819865,"Standard subscriber with Galaxy S23 on Business Unlimited plan, average 118.7GB monthly usage, business data usage"
310260000000197,SUB-00000197,Business Unlimited,iPhone 15 Pro,5G mmWave,Premium,14439.142929048388,93.31018402467866,2025-12-26 16:03:01.328249,0.7715451617006486,"Business Unlimited customer using iPhone 15 Pro, Premium tier with high churn risk, typical usage 93.3GB/month"
310260000000198,SUB-00000198,Essentials,iPhone 15 Pro,LTE Advanced,MVNO,10332.451374974222,72.59529736938119,2025-12-11 16:03:01.328249,0.5171599221661087,"Long-term MVNO subscriber on Essentials, iPhone 15 Pro user with social media focused, 72.6GB average consumption"
310260000000199,SUB-00000199,Unlimited Elite,OnePlus 11,LTE Advanced,Value,8042.862976836019,26.594913860116776,2025-11-26 16:03:01.328249,0.21866434998084747,"OnePlus 11 user in Value segment, Unlimited Elite plan with low retention risk, 26.6GB monthly data"
310260000000200,SUB-00000200,Magenta Max,iPhone 14,5G Sub-6,Premium,846.6433633082802,125.96655591152107,2025-11-11 16:03:01.328249,0.5784111242900194,"Premium tier customer with iPhone 14, Magenta Max subscription, peak hour heavy user, averaging 126.0GB per month"
